Handle_Name,Persona,Platform,SEO_Trend_Keyword,Strategic_Purpose,Availability_Status,Priority_Tier,Registration_Deadline,Bio_Template,Content_Themes,Monetization_Vectors,Posting_Frequency,Cross_Platform_Links,Primary_Hashtags,First_Post_Ideas,Metrics_to_Track,Platform_Requirements,Backup_Handle,Registration_Cost,Account_Verification,Content_Calendar_Link,Revenue_Potential_Estimate,Growth_Timeline_Months,Engagement_Strategy,Community_Rules,Tools_Needed,Analytics_Enabled,Integration_Recipes,Additional_Notes,Current_Status
@AIAutomationAlchemist,Creative Alchemist,TikTok,""AI-Powered Legacy Integration"" (+34% enterprise adoption),Viral short-form content,NEW_CREATION,Tier 1,Week 3 Day 1,"Creative Automation Alchemist | AI Art | Music Generation | DM collabs 👇","60-second tutorials, AI art creation timelapse, prompt engineering hacks, music generation demos, satisfying automation videos, before-after transformations, Python shortcuts, ""Did you know?"" facts, trending sounds","TikTok Creator Fund ($200-$10K/mo), Sponsored products, Link to Ko-fi/YouTube, Viral→ Lead capture",Daily posting (1-3 videos daily for algorithm boost) + Trending sound repurposing,Instagram Reels (cross-post), YouTube Shorts (same content), X (update announcements), Ko-fi (link),#FYP #ForYou #AI #TikTok #Tutorial #GenerativeAI #Automation #Creator,"Hook: ""This AI tool is insane"", Process video showing tool use, Trend hack: Use trending sound + AI topic, Quick tips (30 sec), Before-after transformation, Satisfying coding video, Trend participation (song + AI angle)","View count, Like rate, Share rate, Save rate, Follower growth, Click-through to Ko-fi, Average watch time (>50% is great)",Algorithm favors consistency; NO long gaps; Trend participation crucial; Hook in first 3 sec essential,@SonicPythonomancer (music variant),Free,Phone number + Email + Age requirement (13+),Week 3,Medium-High ($1K-$5K/mo potential),"Fast growth (5K-50K followers possible by month 3 with viral Shorts; 100K+ by month 6+ if consistent)","Post daily minimum; Respond to all comments in first 24h; Use trending sounds immediately; Hook is everything",Respect community; No hateful content; Keep it fun; Support other creators,CapCut (free video editor); TikTok Studio (desktop); TikTok Creator Fund app,YES - TikTok Analytics,Recipe 3: YouTube→TikTok Shorts,FASTEST GROWTH POTENTIAL; Highest viral coefficient of any platform,SETUP_REQUIRED

@PromptEngineeringWizard,Creative Alchemist,Instagram,Prompt Engineering (+top generative AI skill),Tips + templates for creative professionals,NEW_CREATION,Tier 1.5,Week 2 Day 3,"Prompt Engineering Wizard | DALL-E | Midjourney | Share your prompts | Ko-fi for templates","Prompt templates, before-after DALL-E results, ""Try this prompt"" carousel posts, Midjourney tricks, ChatGPT hacks, Creative workflow optimization, Meme templates for creators, Educational Reels",Premium prompt templates ($9.99-$29.99), Ko-fi subscribers, Sponsored posts from AI tools, Course creation, Affiliate commissions,2-3 carousel posts daily + 1-2 Reels daily + 5-10 Stories daily,TikTok (trend reposts), YouTube (long-form tuts), X (threads), Ko-fi (shop link),#PromptEngineering #DALLE #Midjourney #PromptDesign #GenerativeAI #CreativeTools #AIArt #MagicPrompts,"Carousel: 7 Best DALLE Prompts, Midjourney Settings for Different Styles, ChatGPT Prompt Hacks, Prompt Template Library, ""Prompt Engineering 101"" Reel, Trend participation, Behind-the-Scenes prompt testing","Carousel saves (high intent), Reel views, Click-through to Ko-fi, DM inquiry rate, Follower growth, Engagement rate (need 3%+)",Highly visual platform; Templates are core revenue; Creator account essential,@PromptAlchemy_official,Free,Email + 2FA required,Week 3,High ($500-$3K/mo from template sales),"Fast growth (2K-10K followers by month 3; 20K-100K+ by month 6 if Reels go viral)",,Engage with prompt community; Share others' tips; Celebrate beautiful AI art,Support creators; No gatekeeping; Community over competition,Canva Pro (design templates); Ko-fi (shop); Gumroad (optional),YES - Instagram Insights,Recipe TBD,High monetization potential; Template sales = passive income; Viral Reel potential,SETUP_REQUIRED

@SonicPythonomancer,Sonic Pythonomancer,Bandcamp,""Algorithmic Music Generation"" (2.4K/mo searches),Music distribution + monetization,NEW_CREATION,Tier 1,Week 2 Day 2,"SonicPythonomancer | AI-Generated Music | Music from Code | Support independent music | bandcamp.com/SonicPythonomancer","AI-generated music releases, generative composition, Suno integration, Python audio art, experimental electronic, algorithmic composition, behind-the-scenes production process, artist collaborations",Music sales ($1-$15 per album), Streaming royalties (Spotify/Apple/Bandcamp cut), Patreon exclusive tracks, Physical media pre-orders, Licensing for creators,1-2 new releases monthly (albums) + Weekly behind-the-scenes updates,X (announcements), Instagram (visuals), YouTube (process videos), TikTok (30-sec clips),#IndieMusic #GenerativeMusic #Algorithmic #Experimental #Bandcamp #IndieArtist #AIMusic #ElectronicMusic,"Launch first album (5-10 tracks), Behind-the-scenes production process, ""How I made this track"" series, Collaborate with other electronic artists, Announce tour/live shows, Offer exclusive tracks for supporters, Limited edition physical copies announcement",Plays/streams count, Download count, Fan support count (Bandcamp fans), Email list growth, Revenue per release, Growth toward 1000 listeners,Stripe account required; High-quality audio essential; Artist name branding important,@SonicAI_studio (variant),Free (Bandcamp takes 15% of sales),Email + Stripe account required,Week 2,Medium ($500-$2K/mo at scale),"Moderate growth (100-500 followers by month 3; 500-2K by month 6 with consistent releases and cross-promotion)","Daily stories promoting new music; Respond to all fan messages; Collaborate with other artists; Regular release schedule",Artist integrity paramount; Quality over quantity; Support other indie musicians; Thank your fans explicitly,Bandcamp creation tools; DAW (Ableton/FL Studio); Stripe for payments,YES - Bandcamp analytics,Recipe 5: New release→All social platforms,Music monetization requires consistent releases; Best with YouTube presence too,SETUP_REQUIRED

@ToroidalAIAutomation,Quantum Philosopher,ArtStation,""Generative AI Art"" (+450% YoY) + Biophilic Design,"AI-generated visual portfolio, mixed media art",NEW_CREATION,Tier 2,Week 2 Day 3,"ToroidalAvatars | AI-Generated Mixed Media | Quantum Aesthetics | Biophilic Design | quantum-inspired visual art | quantum-fluid-forms.artstation.com","AI-generated imagery, quantum-inspired art, biophilic design, generative texture work, abstract quantum forms, multimodal AI art (image+sound), process timelapse videos, conceptual work",Prints and merchandise ($50-$500+), Commissions ($1K-$10K per project), Licensing for design agencies ($500-$5K), Sponsorships from AI art tools, Patreon exclusive work ($5-$50/mo),"1-2 new pieces monthly (high-quality takes time) + Weekly behind-the-scenes breakdowns","X (announcements), Instagram (visual feed), YouTube (process videos), Patreon (exclusive)","#GenerativeAI #DigitalArt #Quantum #Biophilic #AbstractArt #ArtStation #ConceptArt #AIArt","Launch portfolio with 10-15 best pieces, Behind-the-scenes of generative process (video), Quantum aesthetics series announcement, Collaboration post, Commission availability announcement, Process breakdown timelapse, ""How I created X"" detailed breakdown",Likes on pieces, Follow count, Bookmarks (intent to return), Commission inquiries, Licensing leads, Merch sales,Portfolio quality is paramount; Professional images required; Artist statement essential,@ToroidalAI (variant),Free,Email account required,Week 3,Medium ($500-$2K/mo potential),"Moderate growth (100-500 followers by month 3; 500-2K+ by month 6, but quality followers = commission leads)","Quality > quantity; Engage with art community; Respond to all commission inquiries; Share other artists work",Respect other artists; No AI art gatekeeping; Commission fairly; Celebrate good design,Adobe Creative Suite (or Procreate); DAW for audio integration; Etsy for merch,YES - ArtStation analytics,Recipe TBD,Best for commission revenue and design agency partnerships; High-ticket sales,SETUP_REQUIRED

@QuantumForgeAI,Core Brand,Dev.to,""AI API Integration"" + Developer Community,Technical blogging platform,AVAILABLE,Tier 2,Week 2 Day 4,"Quantum Automation Engineer | Building AI pipelines | QuantumForgeLabs.org | 950+ open-source scripts | Helping devs master automation","Technical tutorials, API integration guides, Python tips, chaos engineering frameworks, code walkthroughs, developer experience improvements, framework comparisons, troubleshooting guides, code snippets","Dev.to community reputation (leads to consulting), Sponsorships from dev tools, Course creation, O'Reilly partnerships, Tech writing gigs",1-2 technical articles per week (1500-3000 words each) + Daily community engagement,GitHub (code), Medium (some reposts), YouTube (video versions), X (announcement),#DevCommunity #API #Python #Automation #OpenSource #TechWriting #Developer #Coding,"API Integration 101, Chaos Engineering Framework Walkthrough, ""5 Python Mistakes I See Often"", How to Debug Production Issues, Open-source contribution guide, Performance optimization for Python, Architectural patterns for automation",Article likes (aim 50+), Comment quality (deep discussions), Bookmark count, Share count, Personal page views,DEV community values engagement; Comment on others' posts heavily; No pure self-promo,QuantumForgeLabs (variant),Free,Email + GitHub integration recommended,Week 3,Medium ($0-$500/mo directly; high consulting lead value),"Moderate growth (500-2K followers by month 3; 2K-10K by month 6 with consistency)","Daily community engagement; Comment on 10+ posts daily; Help others solve problems; Share others' work",Respect DEV community; High technical quality; Original thoughts; Support newbies learning,GitHub for code examples; Dev.to editor is excellent,YES - Dev.to analytics,Recipe TBD,Best for developer community credibility; Strong for consulting leads from technical audience,SETUP_REQUIRED

@QuantumForgeLabs,Core Brand,Substack (Optional),""AI Ethics Guidelines"" + Newsletter Building,Email community building,OPTIONAL,Tier 3,Week 3 Day 1,"QuantumForgeLabs Newsletter | Weekly on Quantum Automation, Generative AI, and Philosophy | Join 100+ subscribers","Weekly essays (long-form, 2000+ words), exclusive insights, research findings, subscriber-only content, subscriber asks/polls, community highlights, reading recommendations, early access to content before public","Substack Pro subscription (reader support: $5-$50/mo per reader), Sponsorships from companies ($1K-$5K per sponsor), Premium tier ($5-$20/mo for exclusive content)","1 weekly email (every Sunday or Monday) + 1-2 bonus emails per month for premium subscribers",X (announces new issues), Medium (some essays), Ko-fi (link), Website (cross-post),#Newsletter #SubStack #QuantumML #AI #Philosophy #Writing #Automation #EmailCommunity,"Launch with ""Why I'm starting this newsletter"" issue, Issue 1: Deep dive on quantum thinking, Issue 2: AI ethics manifesto, Subscriber-only bonus content, ""Ask Me Anything"" thread, Partner interview, Research findings share, Exclusive code/template share",Subscriber count (goal: 100+ by month 3; 1000+ by month 6), Paid subscriber rate (aim 5-10%), Open rate (aim 40%+), Click rate (aim 20%+), Share rate,Substack Pro needed for premium features (~$12/mo)",QuantumForgeNewsletter (variant),Free (Substack takes 10% of paid subscriptions),Email + Payment setup,Week 3,Medium ($100-$500/mo potential),"Moderate growth (50-200 subscribers by month 3; 500-2000+ by month 6 with cross-promotion)","Weekly consistency is essential; Value first before asking for payment; Email is intimate—be authentic",Subscriber respect paramount; No spam; Over-deliver on value; Thank subscribers explicitly,Substack is all you need; Carrd for landing page optional,YES - Substack analytics,Recipe 1: Essay→Newsletter highlight,Best for building deep audience relationships; Highest lifetime customer value,OPTIONAL_SETUP

@QuantumForgeLabs,Core Brand,Ko-fi,"Prompt Engineering Templates" + Premium Courses,Monetization hub,OPTIONAL,Tier 2,Week 3 Day 2,"QuantumForgeLabs Ko-fi | Premium Audits, Courses, Templates | Support the work or buy courses | ko-fi.com/QuantumForgeLabs","Prompt engineering templates ($9.99-$29.99), Mini-courses ($19.99-$99.99), Comprehensive courses ($99.99-$499.99), ""Buy me a coffee"" donations, Monthly memberships, exclusive Discord access, community marketplace","Immediate revenue from course/template sales, Subscription members ($5-$25/mo × 100+ members = $500-$2500/mo), Donations ($50-$500/month), Affiliate commission potential",Ongoing - Add new products 1-2x monthly; Update existing courses; Manage new orders,X (promotion), Instagram (link in bio), Patreon (alternative), YouTube (link in description),#SupportCreators #KoFi #Courses #Templates #Creators #IndieCreator #BuyMeACoffee #CreatorEconomy,"Ko-fi shop launch with 5-10 initial products, ""Prompt Engineering 101"" course, ""Automation Audit"" service, Monthly membership tier, Donation button, Affiliate product links, Limited-edition templates drops",Sales per product, Customer lifetime value, Refund rate, Repeat purchase rate, Email list growth from purchases,Ko-fi account + Payment processor setup required,QuantumForge_Shop (variant),Free (Ko-fi takes 5% of sales),Email + Payment setup,Week 3,High ($500-$3K/mo potential),"Revenue grows with audience (aim $500/mo by month 3; $1-2K+/mo by month 6 with audience growth)","Regularly add new products; Offer bundles; Create scarcity with limited-edition drops; Email customers special offers",Deliver excellence; Support customers; Create genuine value; Fair pricing,Ko-fi platform is excellent; Gumroad alternative; Stripe directly also possible,YES - Ko-fi analytics,Recipe TBD,ESSENTIAL for immediate monetization; Best platform for small creator monetization,OPTIONAL_SETUP

@QuantumForgeLabs,Core Brand,Patreon,Monthly Membership + Exclusive Content,Recurring revenue,OPTIONAL,Tier 2,Week 3 Day 3,"Support QuantumForgeLabs on Patreon | $1-$100/mo tiers | Exclusive discord, courses, early access | patreon.com/QuantumForgeLabs","Tier 1 ($1/mo): Join community & early access to posts, Tier 2 ($5/mo): Exclusive Discord channel, Tier 3 ($20/mo): Monthly 1-on-1 calls, Tier 4 ($100/mo): Custom automation audit, Exclusive content (code, templates, early essays), Monthly community calls, Member highlights, Advisory board access","Monthly recurring revenue from membership tiers ($1K-$10K/mo at scale), One-time course sales, Consulting from Patreon audience, Sponsorships with Patreon creators",Ongoing - Deliver on tier promises; Monthly calls; Exclusive content creation,X (promotion), Discord (link), Ko-fi (alternative), Email,#Patreon #CreatorSupport #MembershipCommunity #SupportIndependent #TierSupport #Creator #Creators #Community,"Patreon launch with 4-5 tier options, ""Join our community"" announcement, Tier benefits breakdown, First exclusive video/code for members, Monthly all-hands call announcement, Tier bonus (limited-time offer), Member spotlight series","Patrons count (goal: 50+ by month 3; 200+ by month 6), Average pledge amount, Churn rate (should be <5%), Tier upgrade rate, Lifetime value per patron",Patreon account + Payment setup required; Consistent delivery essential,QuantumForge_Patreon (variant),Free (Patreon takes 5-8%),Email + Payment setup,Week 3,High ($500-$5K/mo potential),"Revenue grows with audience (aim 20-50 patrons/$100-$250/mo by month 3; 100-200+/$500-$2K+/mo by month 6)","Consistent content delivery to patrons; Monthly calls show you care; Over-deliver on promises; Celebrate milestones",Member respect paramount; Transparency on road map; No over-selling; Member exclusivity genuine,Patreon platform excellent; Creator Studio for easy management,YES - Patreon analytics,Recipe TBD,BEST for recurring revenue; Sustainable long-term income if scaled,OPTIONAL_SETUP

@ChaosPhilosopher,Chaos Philosopher,Medium,""AI Ethics & Guidelines"" (+420% YoY) + Philosophical Essays,Long-form philosophy + thought leadership,AVAILABLE,Tier 2,Week 2 Day 2,"AI Ethics Philosopher | Exploring consciousness in code | Medium essays on responsibility | quantumforgelabs.org | Defending humanism in the AI era","Deep philosophical essays on AI ethics, consciousness, responsibility, legacy system philosophy, chaos theory applications, technical philosophy, societal impact of AI, future of work, human dignity, moral frameworks for automation","Medium Partner Program ($100-$1K/mo from reads), O'Reilly partnerships, Speaking engagements, Book deals, Consulting on ethics, Thought leadership positioning",1-2 philosophical essays per week (2500-4000 words each) + Comments on other essays,X (promote essays), LinkedIn (professional snippets), Discord (discussion starters), Ko-fi (support option),#AIEthics #Philosophy #Technology #Consciousness #Ethics #Responsibility #AI #Humanism,"Essay 1: ""The Consciousness in Code"", Essay 2: ""AI Ethics for the Real World"", Essay 3: ""Why We Need Digital Humanists"", Essay 4: ""The Beautiful Legacy of Old Code"", Essay 5: ""Responsibility in the Age of Generative Models""","Clap count (aim 100+ per essay), Read time (track 15+ min reads), Highlight count (readers highlighting passages), Share rate, Subscriber growth, Partner program earnings",Editor access helpful; Quality writing paramount; Original thought essential,ChaosPhilosopher_writes (variant),Free,Email + 2FA required,Week 3,Medium-High ($200-$1K/mo from Partner Program),"Moderate growth (300-1K followers by month 3; 1K-5K followers by month 6 with strong writing)","Engage with philosophy community; Comment meaningfully on others' essays; Build intellectual reputation",Respect different viewpoints; Nuanced arguments; No dismissal of concerns; Intellectual humility,Grammarly Pro; Notion for research,YES - Medium Analytics,Recipe TBD,Best for book deals + speaking engagements; High-leverage thought leadership,SETUP_REQUIRED
