Handle_Name,Persona,Platform,SEO_Trend_Keyword,Strategic_Purpose,Availability_Status,Priority_Tier,Registration_Deadline,Bio_Template,Content_Themes,Monetization_Vectors,Posting_Frequency,Cross_Platform_Links,Primary_Hashtags,First_Post_Ideas,Metrics_to_Track,Platform_Requirements,Backup_Handle,Registration_Cost,Account_Verification,Content_Calendar_Link,Revenue_Potential_Estimate,Growth_Timeline_Months,Engagement_Strategy,Community_Rules,Tools_Needed,Analytics_Enabled,Integration_Recipes,Additional_Notes,Current_Status
@QuantumAuTomAIton,Quantum Philosopher,X/Twitter,Quantum Machine Learning (+370% YoY),Philosophical takes on quantum + automation + ethics,AVAILABLE,Tier 1,Week 1 Day 1,"Quantum Automation Engineer | Generative AI | Ethics & Philosophy | QuantumForgeLabs.org","Quantum thinking, automation ethics, AI safety, machine learning, Python scripts, chaos engineering, quantum computing, prompt engineering","Consulting ($5K-$25K audits), Premium community access ($99-$499/mo), Speaking fees, B2B services",3-5 tweets daily + 1 thread weekly,GitHub (code), Medium (essays), YouTube (tutorials), Discord (community),#QuantumML #Automation #AIEthics #GenerativeAI #PythonAutomation #ChaosEngineering,"Thread on quantum cognition improving systems, Ethics of automation thread, ""Why quantum randomness beats determinism"" hot take, Chaos engineering framework walkthrough, ""Quantum-safe automation for enterprises"" announcement",Daily followers count,Custom Twitter headers allowed,@QuantumAutoMaItion (variant),Free,Email + 2FA required,Week 3,High ($5K-$25K/mo potential),"Fast growth expected (1K-10K by month 3, 50K+ by month 6)",Reply to ALL comments week 1-2; Engage with 20+ accounts daily; Retweet valuable content from community,Share knowledge freely; No gatekeeping; Support other creators,Buffer/Meta Suite for scheduling,YES - Twitter Analytics,Recipe 1: Medium post→Tweet thread,Highest priority for authority; Most time-sensitive for trending keyword,SETUP_REQUIRED

@AIAutomationAlchemist,Creative Alchemist,X/Twitter,Generative AI (+450% YoY),Generative AI + prompt engineering for creatives,AVAILABLE,Tier 1,Week 1 Day 2,"AI Art Alchemist 🎨 | Generative Workflows | Prompt Engineering | QuantumForgeLabs","Generative art, prompt engineering, AI music, creative automation, DALL-E, MidJourney, Suno, multimodal AI, creative tech","Premium templates ($29-$99), Creative audits ($2K-$10K), Sponsored content, Patreon ($100-$5K/mo), Ko-fi courses","3-5 tweets daily + 1 thread weekly + visual posts",Instagram (art), YouTube (tutorials), ArtStation (portfolio), Bandcamp (music),#GenerativeAI #PromptEngineering #AIArt #CreativeAutomation #DALLE #MidJourney #AIMusic #Multimodal,"Launch with 7 Prompt Templates thread, DALL-E Mastery 101 thread, ""How to automate without losing soul"" thread, AI music generation workflow demo, Sponsored tool/platform announcement",Engagement rate (RT+Fav), Follower growth, Click-through to Ko-fi,2FA recommended,@AIAutomationAlchemist_official,Free,Email + 2FA required,Week 3,Very High ($2K-$10K/mo potential),"Moderate growth expected (500-5K by month 3, 20K-50K by month 6)",Engage with art community; Share others' work; Build relationships with creators,Celebrate creative work; Support indie artists; No NFT spam,Buffer + Canva Pro for graphics,YES - Twitter Analytics,Recipe 2: Suno release→Tweet announcement,Creative niche has high monetization; strong Patreon potential,SETUP_REQUIRED

@ChaosEngineeringAI,Systems Engineer,X/Twitter,Chaos Engineering in DevOps,DevOps + AI testing frameworks,AVAILABLE,Tier 1,Week 1 Day 2,"Chaos Engineering AI | DevOps Automation | System Reliability | QuantumForgeLabs","Chaos engineering, system testing, DevOps, microservices, reliability engineering, failure prediction, AI testing, automation frameworks, Python scripts","Enterprise consulting ($10K-$100K), Open-source sponsorships, B2B training, Tool licensing",3-5 tweets daily + 1 thread weekly + code snippets,GitHub (projects), Reddit (r/Automation), Stack Overflow (answers),#ChaosEngineering #DevOps #Microservices #SystemReliability #Automation #PythonScripts #CI_CD,"Chaos Engineering Patterns thread, Why you need chaos testing thread, AI-driven bug prediction demo, ""Before you go to production"" reliability checklist, Open-source framework announcement",Engagement from DevOps audience, Technical question replies,Verified badge helpful but not required,@ChaosAI_Engineer (variant),Free,Email + 2FA required,Week 3,High ($10K-$50K/mo potential),"Slower initial growth but higher-value audience (1K specialized followers = $20K+ consulting leads by month 6)",Answer technical questions deeply; Help others solve problems; Build reputation,Respect expertise levels; Welcome questions; Promote learning,Buffer + GitHub integration,YES - Twitter Analytics,Recipe 3: GitHub release→Engineering thread,Enterprise market = highest revenue potential,SETUP_REQUIRED

@DrFrankenstack,Chaos Philosopher,X/Twitter,Legacy Code + AI Integration,Resurrect old systems with modern AI,AVAILABLE,Tier 1,Week 1 Day 3,"Legacy System Resurrection Engineer | AI + Philosophy | QuantumForgeLabs","Legacy code, system modernization, resurrection opportunities, enterprise transformation, Y2K wisdom, technical debt, architecture migration, philosophy of code","Legacy audits ($15K-$100K+), Migration consulting, Training programs, Medium Partner Program revenue, Writing projects",3-5 tweets daily + 1 thread weekly + essays,GitHub (migration patterns), Medium (essays), Reddit (r/programming),#LegacyCode #SystemModernization #EnterpriseAI #ArchitectureMigration #TechnicalDebt #CodePhilosophy,"The beauty of legacy code thread, Y2K wasn't about dates—it was about consciousness, How to respectfully modernize without destroying soul, ""Every bug is wisdom trying to teach you"" philosophical thread, Enterprise transformation case study announcement",Engagement from enterprise engineers,Verification helpful,@DrFrankenstein_stack,Free,Email + 2FA required,Week 3,High ($15K-$50K/mo potential),"Moderate growth to highly engaged enterprise audience (500-2K followers with $50K+ annual revenue potential)",Build relationships with enterprises; Help them see legacy as asset not burden; Case study approach,Respect legacy systems; Mentor less experienced devs; Encourage modernization thinking,Buffer + Medium for long-form,YES - Twitter Analytics,Recipe 4: Medium essay→Thread+LinkedIn,Best for B2B enterprise consulting revenue,SETUP_REQUIRED

@SonicPythonomancer,Sonic Pythonomancer,X/Twitter,AI Music Generation (+60% adoption),Music generation + Python,AVAILABLE,Tier 1.5,Week 1 Day 4,"Sonic Pythonomancer | AI Music + Python | Music Generation | QuantumForgeLabs","Music generation, Suno integration, Python music, generative composition, audio processing, machine learning music, creative coding, sonic alchemy","Music streaming royalties, Workshops ($500-$2K), Licensing music, Premium production templates ($29-$99), Bandcamp sales",2-4 tweets daily + demos weekly + music updates,Bandcamp (releases), YouTube (tutorials), Instagram (Reels), TikTok (music),#AIMusic #MusicGeneration #GenerativeMusic #Python #AudioProcessing #Suno #MusicTech #SonicAlchemy,"Music generation pipeline tutorial thread, Suno integration guide, 5 Synthesis Techniques thread, ""Code as musical instrument"" philosophical thread, New Bandcamp release announcement",Music engagement rate, Stream counts, Click-through to Bandcamp,Verification helpful,@SonicAI_Generator,Free,Email + 2FA required,Week 3,Medium-High ($1K-$5K/mo potential),"Moderate growth to niche audience (2K-10K followers by month 6, but highly engaged)",Engage with musicians and producers; Share music from other AI creators; Build producer community,Support artist community; Cross-promote other musicians; Celebrate creative work,Buffer + Bandcamp integration,YES - Twitter Analytics,Recipe 5: Bandcamp→All platforms,High streaming potential + teaching revenue,SETUP_REQUIRED

@QuantumAuTomAIton,Quantum Philosopher,Instagram,Quantum Machine Learning + AI Ethics,Visual thought leadership on quantum concepts,AVAILABLE,Tier 1.5,Week 2 Day 1,"Quantum Automation Engineer | AI Alchemist | QuantumForgeLabs.org","Quantum concepts visualized, AI ethics discussions, automation workflows, Python scripts showcase, conference talks, thought leadership content","Consulting leads, Sponsored posts from companies, Link to Ko-fi/Patreon, Brand partnerships",1-2 carousels + 3-5 stories daily + 1 Reel weekly,X (threads), YouTube (channel), Medium (essays), Bluesky,#QuantumML #AIEthics #Automation #GenerativeAI #PythonDeveloper #QuantumComputing #TechPhilosophy,Quantum computing carousel (5 slides), Ethics of automation carousel, Workflow visualization Reel, Confidence interval philosophy carousel,Engagement rate (saves = decision-making), Carousel interaction, Reel views,Creator account required,@QuantumAutoMation_official,Free,Email + 2FA required,Week 3,Medium ($1K-$5K/mo potential),"Steady growth (1K-5K followers by month 3, 10K-30K by month 6, engaged audience)",,Engage with tech community; Reply to all comments; Use Stories for authenticity,No bots; Support other creators; Create value-first content,Canva Pro for carousels; Buffer for scheduling,YES - Instagram Insights,Recipe 1: Medium→Carousel repost,Visual learning platform; Strong for thought leadership positioning,SETUP_REQUIRED

@AIAutomationAlchemist,Creative Alchemist,Instagram,Generative AI Art + Multimodal AI,Visual portfolio of AI art mastery,AVAILABLE,Tier 1,Week 2 Day 1,"Creative Automation Alchemist | AI Art & Music | DM collabs | QuantumForgeLabs","AI-generated art, prompt engineering tips, creative workflow demos, music generation visuals, collaboration announcements, Reels of creation process",Premium prompts ($29-$99), Creative audits, Ko-fi subscribers, Sponsored posts from AI tools, Link to YouTube courses,3-5 posts daily + 3-5 stories daily + 2-3 Reels weekly,X (threads), YouTube (tutorials), ArtStation (portfolio), TikTok,#GenerativeAI #AIArt #PromptEngineering #DALLE #Midjourney #CreativeAI #AIMusic #ArtTok,"Carousel: 7 Best DALL-E Prompts, Before-After DALL-E Mastery, Music Generation Workflow Reel, Behind-the-Scenes Prompt Engineering, AI Art Trends carousel",Reel views (go for viral), Carousel saves, DM inquiries for collabs,Creator account REQUIRED - switch immediately,@AIAlchemist_official,Free,Email + 2FA required,Week 3,Very High ($2K-$10K/mo potential),"Fast growth (2K-10K followers by month 3, 30K-100K+ by month 6 if Reels go viral)",Post reels daily for algorithm boost; Respond to all DMs within 24h; Use trending sounds,Celebrate other artists; Support indie creators; Collab spirit,Canva Pro; CapCut for Reels; Buffer for scheduling,YES - Instagram Insights,Recipe 1: Medium→Carousel OR YouTube→Reel,HIGHEST VIRAL POTENTIAL on Instagram; Best for monetization via Ko-fi + Patreon,SETUP_REQUIRED

@SonicPythonomancer,Sonic Pythonomancer,Instagram,AI Music Generation + Content Creation,Music creation + generative art visuals,AVAILABLE,Tier 1.5,Week 2 Day 2,"Sonic Pythonomancer | AI Music + Code | Creating the Future | Bandcamp Link","Music production process videos, Suno integration demos, AI-generated music visuals, Python code for audio, behind-the-scenes creation, Bandcamp promotional content",Bandcamp sales, Music streaming royalties, Ko-fi pledges for production templates, Sponsored music tools,2-3 posts daily + 3-5 stories daily + 1-2 Reels weekly,X (announcements), Bandcamp (releases), YouTube (tutorials), TikTok (music),#AIMusic #MusicProduction #GenerativeMusic #Python #ProducerLife #AudioProcessing #IndieMusic #Suno,"Carousel: How Suno Works, Production Process Reels, New Album Announcement Carousel, Behind-the-Scenes Music Creation, ""From Code to Sound"" story series",Reel views, Music save counts, Click-through to Bandcamp,Creator account recommended,@SonicPython_official,Free,Email + 2FA required,Week 3,Medium-High ($500-$2K/mo potential),"Moderate growth to engaged music community (1K-5K followers by month 3, 5K-20K by month 6)",,Engage with music community; Support other musicians; Authentic creation story,Build community first; Music quality matters; Support indie artists,CapCut; Canva; Bandcamp link in bio,YES - Instagram Insights,Recipe 5: Bandcamp→Instagram Stories,Music + visual content hybrid; Strong for building audience AND streaming revenue,SETUP_REQUIRED

@QuantumForgeLabs,Core Brand,GitHub,"Python Quantum Scripts (+38.7% CAGR), Open Source AI",Central repository for all code projects,AVAILABLE,Tier 1,Week 1 Day 1,"Quantum Automation Toolkit | 950+ Open-Source Scripts | quantumforgelabs.org | Quantum ML + Python Automation | AI Ethics","Python automation scripts, quantum algorithms, chaos engineering, generative AI tools, music generation APIs, creative automation pipelines, documentation, examples",Open-source sponsorships, GitHub Sponsors ($500-$5K/mo), Consulting leads from code quality, O'Reilly book deals, Training course materials,Daily repo updates + Weekly blog posts via GitHub Pages + New releases monthly,X (announcements), Medium (deep dives), YouTube (tutorials), Discord (support),#Python #OpenSource #QuantumML #Automation #GenerativeAI #ChaosEngineering #GitHubSponsors #DevTools,"Launch 950+ scripts repo, ""Quantum Automation Starter Kit"" repo, ""Chaos Engineering Framework"" repo, Music Generation API wrapper, Documentation site launch, Create GitHub Pages blog","GitHub stars count, Forks count, Contributors count, Issues/PRs quality, Traffic to repo, ""Used by"" companies mention",README excellence essential; Good documentation critical; MIT/Apache license,QuantumForgeAI (variant),Free,GitHub account + 2FA required,Week 1,High ($1K-$5K/mo from Sponsors),"Steady growth (100-500 stars by month 3, 1K-5K stars by month 6+, enterprise interest increases)",,Document obsessively; Respond to all issues/PRs; Support community,Welcoming to contributors; Clear license; Ethical use requirements,GitHub Codespaces; GitHub Pages; GitHub Actions,YES - GitHub Insights,Recipe 2: New release→Announcement across platforms,Foundation of all authority; Code is proof of mastery,SETUP_REQUIRED

@QuantumForgeLabs,Core Brand,Discord,"Multimodal AI Community Building, Quantum ML Community",Central community hub,NEW_CREATION,Tier 1,Week 2 Day 1,"QuantumForgeLabs Community Server | Quantum Automation + Generative AI | Free + Premium","Community discussions, project collaboration, learning channels, member showcases, announcements, chaos engineering tests, music generation experiments, code reviews","Premium membership tiers ($5-$25/mo for 100-1000 members = $500-$25K/mo), Channel sponsorships, Community marketplace, Exclusive content access, Consulting for members",Continuous (community runs 24/7) + Daily moderation + Weekly calls,X (announcements), GitHub (projects), YouTube (exclusive streams), Medium (essays),#QuantumML #Community #AI #Python #OpenSource #GenerativeAI #ChaosEngineering #CommunityDriven,"Welcome message (500 words), Channel introductions, Weekly discussion prompt, ""Project Showcase"" spotlight, Friday community call announcement, New member welcome bot message",Member count growth, Engagement/message ratio, Premium conversion rate, Member retention,Server emoji custom set; Voice channels; Bot management; Mod tools setup,QuantumForge_Community (variant),Free,Email + 2FA + Discord server creation,Week 3,High ($500-$5K/mo from premium tiers),"Moderate to high growth (50-500 members by month 3, 500-5000+ by month 6 with retention focus)",Daily presence; Respond to all questions; Celebrate member wins; Create FOMO for premium,No harassment; Inclusive; Quality over quantity; Respect expertise,Discord.py for bots; Statbot for analytics; IFTTT for cross-posting,YES - Discord dashboard,Recipe 4: X→Discord announcement,Community = highest lifetime customer value; Premium tiers = sustainable revenue,SETUP_REQUIRED

@QuantumForgeLabs,Core Brand,Medium,AI Ethics + Python Automation,Long-form thought leadership,AVAILABLE,Tier 1,Week 2 Day 1,"Quantum Automation Engineer | AI Alchemist | QuantumForgeLabs.org | exploring the intersection of quantum thinking and code","Deep dives on quantum ML, AI ethics, automation philosophies, practical Python guides, chaos engineering frameworks, generative AI theory, market analysis, thought pieces",Medium Partner Program ($100-$5K/mo from reads), Ko-fi/Patreon sponsorships, Consulting leads, O'Reilly/book deals, Course creation,1 article per week (2000-3000 words each),X (threads), LinkedIn (snippets), YouTube (video essays), Discord (discussion starters),#QuantumML #AIEthics #Python #Automation #Generative #Philosophy #ChaosEngineering #TechThought,"Why Quantum Thinking Improves Deterministic Systems, AI Ethics in 2025: A manifesto, Chaos Engineering is Enlightenment Work, 950 Scripts: A Philosophy of Modularity, The Beauty of Legacy Code, Generative Automation Without Soul Loss",Article read time (aim 10+ min), Clap count, Share count, Member subscriptions generated,Editor access helpful but not required,QuantumForge_Engineering (variant),Free,Email + 2FA required,Week 3,High ($500-$3K/mo from Partner Program),"Moderate growth (500-5K followers by month 3, 5K-20K by month 6 with 50K+ monthly reads)",,Write with authority; Back claims with data; Philosophical yet practical,Original thought; No clickbait; Support other writers,Grammarly Pro for editing; Notion for drafting,YES - Medium Analytics,Recipe 1: Essay→Threads+Posts,Best for building thought leadership authority; Strong monetization,SETUP_REQUIRED

@QuantumAuTomAIton,Quantum Philosopher,YouTube,""Automated GPT-4 Pipelines"" (+410% YoY) + Tutorial Content,Educational video series,NEW_CREATION,Tier 1,Week 2 Day 2,"QuantumForgeLabs | Tutorials on Quantum + Automation | AI Workflows | Subscribe for weekly uploads","Tutorials (10-15 min), live coding, framework explanations, API integrations, chaos engineering demos, music generation walkthroughs, philosophy deep-dives, community highlights, Q&A videos",AdSense revenue ($1K-$5K/mo at scale), Sponsored videos ($2K-$10K each), Course sales ($500-$5K per course), YouTube membership ($5-$25/mo), Link to Ko-fi/services,1 long-form video weekly (10-30 min) + 2-3 Shorts weekly,X (announcements), Medium (script sources), Discord (community feedback), Patreon (exclusive),#Tutorial #Quantum #Python #AI #Automation #GenerativeAI #LearnToCode #YouTubeEducation,"Quantum Automation in 15 Minutes, How to Build a Music Generation Pipeline, Chaos Engineering Explained, ""I Deployed AI to Production"" series, API Integration Masterclass, Python Workflow Optimization","Total views (long-form + shorts), Engagement (likes + comments), Click-through rate to website, Subscriber growth, Watch time (key for algorithm), Conversion to premium offer",Custom banner; End screens; Cards + CTAs essential; Consistent upload schedule essential,@AIAutomationAlchemist (variant),Free,Email + 2FA + Channel setup,Week 2,Very High ($5K-$50K/mo potential at scale),"Exponential growth (5K-50K subscribers by month 3 is possible with viral Shorts; 50K-500K+ by month 6+ with consistent schedule)",Daily YouTube interaction; Respond to comments within 24h; Pin top comments; Create Shorts from each video,Protect community; No spam links; Educational value paramount,Adobe Premiere (editing); OBS (streaming); CapCut (Shorts); Anchor (podcasting if repurposing),YES - YouTube Analytics,Recipe 3: YouTube→Shorts+Threads+LinkedIn,HIGHEST GROWTH POTENTIAL platform; Exponential subscriber growth possible,SETUP_REQUIRED

@QuantumForgeLabs,Core Brand,LinkedIn,"AI in Cybersecurity" (+385% YoY) + B2B Thought Leadership,Enterprise professional network,AVAILABLE,Tier 1,Week 2 Day 3,"Quantum Automation Engineer | AI/ML | Building the future of intelligent automation | QuantumForgeLabs.org","Enterprise automation case studies, professional insights, company milestones, industry trends, hiring announcements, speaking engagement promotion, B2B partnership announcements, career advice",Enterprise consulting ($10K-$100K), LinkedIn newsletter sponsorships, Executive coaching, B2B tool licensing,1 main post daily + 1 article weekly + Stories 2-3x daily,X (cross-post), Medium (source), Company page updates, Email newsletter,#AI #MachineLearning #Automation #Enterprise #QuantumComputing #Leadership #Innovation #TechLeadership,"LinkedIn Article: Future of Enterprise Automation, Company milestone announcement, Case study: How we automated legacy systems, Speaking engagement announcement, Hiring post, Industry trend analysis, Partner announcement",Post engagement (comments = sales leads), Follower growth, Profile views, Article reads, Click-through to consulting,LinkedIn company page ESSENTIAL; Endorsements helpful; Recommendations crucial,QuantumForgeLabs_official (variant),Free,Email + 2FA + Phone verification,Week 2,High ($5K-$25K/mo from consulting leads),"Steady professional growth (500-2K followers by month 3, 5K-20K+ enterprise followers by month 6)",,Connect authentically; Focus on value; Make asks after giving,Quality network > quantity; Support others; B2B focus,LinkedIn Sales Navigator (optional), Dex (contact management),YES - LinkedIn Analytics,Recipe 6: Article→Post+Email,BEST PLATFORM for enterprise B2B consulting leads; High-value customer source,SETUP_REQUIRED

@QuantumForgeLabs,Core Brand,Bluesky,"Quantum AI Ethics" + Intellectual Culture,Decentralized intellectual community,AVAILABLE,Tier 1,Week 2 Day 4,"Quantum Automation + Generative AI | Decentralized community vibes | quantumforgelabs.org | Posts on consciousness in code","Philosophical takes on AI, long-form discussions, deep threads, community culture, ethics debates, peer-to-peer recommendations, knowledge sharing, original research","Community reputation/authority (leads to consulting), Bluesky Creator Fund (when available), Exclusive content paywalls (future feature), Community building","3-5 posts daily + 1 long thread weekly + Discussion participation",X (cross-post some), Medium (source essays), Discord (community building), GitHub (code sharing),#BlueskyAI #QuantumML #AI #Ethics #Philosophy #Decentralized #OpenWeb #IntellectualCulture,"Intro post: Who we are and why Bluesky, Long-form essay on AI consciousness, Quantum vs determinism thread, AI ethics hot take, Invite friends to join, Celebrate community members","Follower count, Like/RT ratio, Thread engagement, Conversation starters, Building community identity",ATProto native features; Early adopter advantage; Network small initially (OK!),@QuantumForge.bsky.social (variant),Free,Email + 2FA required,Week 3,Medium ($0-$500/mo currently; potential future revenue),"Moderate growth (100-1K followers by month 3 as platform grows; early mover advantage is valuable)","Post original ideas; Don't just cross-post X; Build genuine Bluesky community",Respect intellectual culture; High bar for quality; No spam links,Bluesky app; Futureland for analytics,YES (when available),Recipe TBD,Early-mover advantage in emerging platform; Best for intellectual positioning,SETUP_REQUIRED

@GlitchWizardry,Chaos Philosopher,Reddit,"Agentic AI Testing" + Problem Solving,Problem-solving expert reputation,AVAILABLE,Tier 1.5,Week 2 Day 4,"Just here to help solve problems. Check GitHub for full work. Ask me about chaos engineering or legacy system resurrection.","Answering hard questions, solving technical problems, contributing to communities, case studies, automation examples, chaos framework discussions, helping others learn",Consulting leads from expertise demonstration, Community reputation (not direct revenue), Referrals from network building,Daily participation (1-2 hours) + 1-2 new posts weekly,GitHub (projects), Medium (essays), X (announcements), YouTube (tutorials),#Python #Automation #ChaosEngineering #MachineLearning #DevOps #LegacyCode #Programming #OpenSource,"First post in r/Automation: Chaos Framework 101, Helpful comment threads in r/Python, Answer in r/Learnprogramming, Problem-solving case study, Share GitHub project, Help with specific technical issue, Promote community knowledge share",Karma (community reputation), Comment votes, Award count, Post saves, Community upvotes,No karma limit for posting (usually); Niche subreddits easier initially,u/GlitchWizard (variant),Free,Email + account age requirement (some subreddits),Week 3,High (consulting leads from expertise),"Moderate to high community reputation (1K-10K karma by month 3; valuable for networking)","Answer authentically and deeply; Don't self-promote (builds trust first); Provide value freely",Help others first; No spam; Respect subreddit rules; Quality over quantity,Reddit Enhancement Suite (optional); Notion for tracking ideas,YES - Reddit analytics,Recipe TBD,Best for building B2B consulting authority; High-value network building,SETUP_REQUIRED

